{
    "name": "Skulitan",
    "race": "Skeleton",
    "class": "Healer",
    "element": "Earth",
    "health": 8,
    "attack": 11,
    "defense": 9,
    "speed": 22,
    "active_abilities": [
        {
            "name": "Bone Club",
            "type": "attack",
            "element": "Earth",
            "amount": 3,
            "effect": [],
            "target": "Opponent",
            "energy": 1
        },
        {
            "name": "Necrotic Ritual",
            "type": "heal",
            "element": "Earth",
            "amount": 10,
            "effect": [],
            "target": "Team",
            "energy": 5
        },
        {
            "name": "Magic Stones",
            "type": "attack",
            "element": "Earth",
            "amount": 6,
            "effect": [],
            "target": "Opponent",
            "energy": 3
        }
    ],
    "passive_abilities": []
}