{
    "name": "Magma Skeletal Warrior",
    "race": "Skeleton",
    "class": "Warrior",
    "element": "Fire",
    "health": 30,
    "attack": 20,
    "defense": 20,
    "speed": 4,
    "active_abilities": [
        {
            "name": "Searing Charge",
            "type": "attack",
            "element": "Fire",
            "amount": 3,
            "effect": [],
            "target": "Opponent",
            "energy": 1
        },
        {
            "name": "Infernal Assault",
            "type": "attack",
            "element": "Fire",
            "amount": 3,
            "effect": [],
            "target": "Opponent",
            "energy": 1
        }
    ],
    "passive_abilities": []
}