{
    "name": "Goblino",
    "race": "Goblin",
    "class": "Rogue",
    "element": "Air",
    "health": 12,
    "attack": 13,
    "defense": 11,
    "speed": 28,
    "active_abilities": [
        {
            "name": "Knife Gust",
            "type": "attack",
            "element": "Air",
            "amount": 3,
            "effect": [],
            "target": "Opponent",
            "energy": 1
        },
        {
            "name": "Surprise Attack",
            "type": "attack",
            "element": "Air",
            "amount": 6,
            "effect": [],
            "target": "Opponent",
            "energy": 3
        }
    ],
    "passive_abilities": []
}